<?xml version="1.0" encoding="utf-8"?>
<Modules xmlns="https://standaarden.overheid.nl/stop/DSO-PI10" 
  xmlns:xsi="http://www.w3.org/2001/XMLSchema-instance" 
  xsi:schemaLocation="https://standaarden.overheid.nl/stop/DSO-PI10 xsd_stop_0.97.1_manifest-ow.xsd">
  <domein>omgevingswet</domein>
  <RegelingVersie>
    <FRBRwork>/akn/nl/act/gm0037/2019/3520</FRBRwork>
    <FRBRExpression>/akn/nl/act/gm0037/2019/3520/nld@2019-01-16</FRBRExpression>
    <Bestand>
      <naam>owActiviteiten-Gemeentestad</naam>
      <objecttype>Activiteit</objecttype>
    </Bestand>
    <Bestand>
      <naam>owGebiedsaanwijzingen-Gemeentestad.xml</naam>
      <objecttype>Gebiedsaanwijzing</objecttype>
    </Bestand>
    <Bestand>
      <naam>owPons-Gemeentestad.xml</naam>
      <objecttype>Pons</objecttype>
    </Bestand>
    <Bestand>
      <naam>owOmgevingsNormOmgevingswaarde.xml</naam>
      <objecttype>OmgevingsNormOmgevingswaarde</objecttype>
    </Bestand>
    <Bestand>
      <naam>owLocaties-Gemeentestad.xml</naam>
      <objecttype>Gebiedengroep</objecttype>
      <objecttype>Gebied</objecttype>
    </Bestand>
    <Bestand>
      <naam>owRegeltekst-Gemeentestad.xml</naam>
      <objecttype>Regeltekst</objecttype>
    </Bestand>
  </RegelingVersie>
</Modules>